PMID,Abstract,Status,PMCID
21635334,"Griffiths, Christian, and Kalish (this issue) present an iterative-learning paradigm applying a Bayesian model to understand inductive biases in categorization. The authors argue that the paradigm is useful as an exploratory tool to understand inductive biases in situations where little is known about the task. It is argued that a theory developed only at the computational level is much like a single-bladed knife that is only useful in highly idealized situations. To be useful as a general tool that cuts through the complex fabric of cognition, we need at least two-bladed scissors that combine both computational and psychological constraints to characterize human behavior. To temper its sometimes expansive claims, it is time to show what a Bayesian model cannot explain. Insight as to how human reality may differ from the Bayesian predictions may shed more light on human cognition than the simpler focus on what the Bayesian approach can explain. There remains much to be done in terms of integrating Bayesian approaches and other approaches in modeling human cognition.",valid,
37062801,"Neonatal hypoxic-ischemic encephalopathy (HIE) that results from perinatal cerebral hypoxia-ischemia has become one of the leading causes of acute mortality and chronic disability in infants and children. Despite that neuronal mitophagy and subsequent clearance of damaged neurons exert protective effect, the pathogenesis of HIE and effective treatment strategies for intervention of HIE remain poorly understood. Here, we report that ubiquitin-specific protease 14 (Usp14, a deubiquitinating enzyme) is closely associated with HIE progression by its negative regulation in neuronal mitophagy in mouse. The expression of Usp14 is elevated in both an oxygen-glucose deprivation (OGD) mouse neuronal cell line culture model in vitro and a HIE mouse model in vivo. Mechanistically, OGD treatment activates Hippo signaling that enhances Yap1 phosphorylation levels at Ser-127 but inhibits Yap1 protein level, which potentiates Usp14 transcription and leads to the downregulated ubiquitination at Lys-63 of Beclin-1, a key molecule in autophagy, resulting in the suppressed neuronal mitophagy, subsequent failure in the clearance of damaged neurons, and finally possible dysregulation in brain functions. Thus, our results provide with Usp14 as a novel target and treatment strategy for intervention of HIE, which may help diagnose and treat HIE in clinic.",valid,
16803093,"A single colloidal sphere circulating around a periodically modulated optical vortex trap can enter a dynamical state in which it intermittently alternates between freely running around the ringlike optical vortex and becoming trapped in local potential energy minima. Velocity fluctuations in this randomly switching state still are characterized by a linear Einstein-like diffusion law, but with an effective diffusion coefficient that is enhanced by more than 2 orders of magnitude.",valid,
23569286,"This paper introduces a Theme Issue presenting the latest developments in research on the interplay between flexibility and constraint in social behaviour, using comparative datasets, long-term field studies and experimental data from both field and laboratory studies of mammals. We first explain our focus on mammals and outline the main components of their social systems, focusing on variation within- and among-species in numerous aspects of social organization, mating system and social structure. We then review the current state of primarily ultimate explanations of this diversity in social behaviour. We approach the question of how and why the balance between behavioural flexibility and continuity is achieved by discussing the genetic, developmental, ecological and social constraints on hypothetically unlimited behavioural flexibility. We introduce the other contributions to this Theme Issue against this background and conclude that constraints are often crucial to the evolution and expression of behavioural flexibility. In exploring these issues, the enduring relevance of Tinbergen's seminal paper 'On aims and methods in ethology', with its advocacy of an integrative, four-pronged approach to studying behaviour becomes apparent: an exceptionally fitting tribute on the 50th anniversary of its publication.",valid,3638441
24305643,"Approximately 10% of patients with rheumatoid arthritis (RA) have interstitial lung disease (ILD), and one-third have subclinical ILD on chest CT scan. In this study, we aimed to further characterize functional decrements in a spectrum of RA-associated ILD.",valid,4077411
908759,"Kinetic data analysis was used to derive a six-compartment computer model which describes the in vivo [3H]25-hydroxyvitamin D3 ([3H]25-OHD3) metabolism in control and strontium rachitic chicks. Plasma concentrations of 25-OHD3 (13 pmol/ml) and 25, 25-dihydroxyvitamin D3 (0.9 pmol/ml) were 18 and 125% greater than controls, respectively, whereas the corresponding level for 1alpha,25-dihydroxyvitamin D3 (0.3 pmol/ml) was only 30% of control. Plasma disappearance of 25-HOD3 was fitted using a two-compartment model in which the metabolite extrapolated half-life was nearly twice as large for strontium rachitic chicks (71 compared to 41 h). Intestinal sequestration of 1alpha,25-dihydroxyvitamin D3 was assumed to be irreversible and was fitted by a single exponential term in which metabolite uptake rate and tissue concentration in strontium rickets was suppressed to 20 and 10% of control, respectively. In contrast, uptake of 25-OHD3 by the intestine was observed to occur by a reversible process in which metabolite concentration was 45% greater in the strontium rachitic compared to control group. The developed compartment model accepts time-dependent control or perturbed metabolite data for the plasma and (or) intestinal pools and provides quantitative values for metabolite pool size, flux rate, and turnover time.",valid,372474
36219935,"This cross-sectional study aimed to explore the relationship between diet quality, dietary diversity, and oxidative stress levels in older adults in parts of the Ningxia Hui Autonomous Region in northwestern China. A total of 335 participants voluntarily participated in the study from April to July 2021. Laboratory tests and questionnaires were used to obtain general characteristics, dietary conditions, and indicators of oxidative stress. The dietary diversity scores of the participants were 5.20±1.39, the diet quality indices were 56.91±11.14, and most had poor diet quality. The levels of the oxidative stress markers malondialdehyde, superoxide dismutase, 8-iso-prostaglandin F2α, and total antioxidant capacity were 4.77±1.77, 40.33±9.85, 763.10±245.41, and 1.02±0.14, respectively. The results showed that the diet quality scores of participants were related to dietary diversity and whether the scores passed or not was significantly related to total antioxidant capacity.",valid,
37160922,"Loss of function in the tumor suppressor gene TP53 is the most common alteration seen in human cancer. In mice, P53 deletion in all cells leads predominantly to the development of T-cell lymphomas, followed by B-cell lymphomas, sarcomas and teratomas. In order to dissect the role of P53 in the hematopoietic system, we generated and analyzed two different mouse models deficient for P53. A pan-hematopoietic P53 deletion mouse was created using Vav1-Cre based deletion; and a B-cell-specific deletion mouse was created using a CD19-Cre based deletion. The Vav1-P53CKO mice predominantly developed T-cell malignancies in younger mice, and myeloid malignancies in older mice. In T-cell malignancies, there was accelerated thymic cell maturation with overexpression of Notch1 and its downstream effectors. CD19-P53CKO mice developed marginal zone expansion in the spleen, followed by marginal zone lymphoma, some of which progressed to diffuse large B-cell lymphomas. Interestingly, marginal zone and diffuse large B-cell lymphomas had a unique gene expression signature characterized by activation of the PI3K pathway, compared with wild type marginal zone or follicular cells of the spleen. This study demonstrates lineage specific P53 deletion leading to distinct phenotypes secondary to unique gene expression programs set in motion.",valid,10169790
16893814,"Active inclusion bodies of recombinant polyphosphate kinase were obtained by simple washing of Escherichia coli cells with nonionic detergent and then they were immobilized in agar/TiO2 beads. Bioenergy beads obtained are charged by polyphosphate to act as rechargeable supply of adenosine/nucleoside triphosphates (ATP/NTP), a practical tool for synthesis of artificial receptors.",valid,
15586644,"Control of high blood pressure is usually difficult when there is an unidentified cause or there exist certain factors that blunt the effect of appropriate therapy. Premenstrual syndrome (PMS) is neither a known cause of hypertension nor is it listed as one of the factors that blunt effect of antihypertensives. PMS defines a constellation of symptoms confined to the luteal phase of the menstrual cycle interfering with individual function but clears after menstruation in the follicular phase. Though there is no consensus yet on its etiopathogenesis, the various models, inconsistent as they are, can initiate or sustain hypertension. The two patients presented had been frustrated by the attitude of their attending physicians who branded them neurotics and the fact that various drug combinations would not control their blood pressure. The classical recurring nature of their symptoms in relation to the menstrual cycle led to the suspicion of and treatment of PMS. With this, it became easy to control their erstwhile ""refractory"" hypertension. It is, therefore, recommended that history of PMS be sought and attended to, when premenopausal women without evidence of secondary hypertension have high blood pressures that proove difficult to control.",valid,2568616
15470000,"Ectopic testicular xenografting can be used to investigate spermatogenesis and as an alternative means for generating transgenic spermatozoa in many species. Improving the efficiency of spermatogenesis in xenografted testicular tissue will aid in the application of using this approach. The present study was conducted to evaluate age-related differences in the establishment of spermatogenesis in grafted testicular tissue from bulls between 2 and 16 wk of life. Testicular tissue was ectopically xenografted under the skin on the backs of castrated nude mice and subsequently evaluated for growth, testosterone production, and establishment of spermatogenesis 24 wk after grafting. The greatest weight increases occurred in donor tissue from calves of the ages 2, 4, and 8 wk compared with the ages of 12 and 16 wk. Recipient mouse serum testosterone concentration was at normal physiological levels 24 wk after grafting and no significant differences were detected between recipients grafted with testicular tissue from bull calves of different ages. The development of germ cells to elongated spermatids were observed in seminiferous tubules of grafts from donor calves of the ages 4, 8, 12, and 16 wk but not observed in grafts from 2-wk donors, which contained round spermatids as the most advanced germ cell stage. Grafts from 8-wk donors contained a significantly higher (10-fold) average percentage of seminiferous tubules with elongated spermatids than all other donor ages. These data demonstrate differences in the ability of testicular tissue from donor animals of different ages to establish spermatogenesis following ectopic testicular xenografting.",valid,
2315842,"A simple method for radiation therapy planning of brain tumors is presented. Therapy portals of midline tumors can easily be determined by comparing sagittal MRI scans with the lateral simulator radiograph. By addition of appropriately processed MR-tomograms a similar planning is possible for parasagittal tumors. Digital data exchange between different operating systems is not necessary with our simple method, problems with varying input/output standards and expensive hardware requirements are thus avoided.",valid,
11565835,"Employing a technology called differential immunization for antigen and antibody discovery (DIAAD), we aimed to generate monoclonal antibodies (mAbs) specific to human multiple myeloma (MM) cells. The fundamental principles of DIAAD rely on the induction of high zone tolerance to the ""wild type"" (normal) antigen. followed by immunization with the modified (diseased) antigen. Because chronic myelogenic leukemia (CML) cells are derived from a lineage closely related to MM, we immunized mice by contrasting a pool of MM cells with CML cells. Monoclonal antibody VAC69 reacted exclusively with MM cells, identifying a membrane molecule composed of a single-chain glycoprotein with a molecular weight of 78-120 kd. This antigen exhibited narrow tissue specificity and was not found on human cancers such as prostate, breast, or cervical carcinoma; leukemia; or lymphoma, nor was it seen on normal human peripheral lymphocytes or on Epstein-Barr virus-transformed B-cell lines. By immunohistochemistry, mAb VAC69 showed no binding to antigens expressed on normal human ovary, breast, prostate, lung or colon tissue, nor did it bind to human breast or prostate cancer. Conversely, mAb VAC69 bound strongly to human MM, although showing only slight binding to histiocytes or inflamed cells in human lymph nodes and human tumors of the colon, lung, and ovary. Monoclonal antibody VAC69 also triggered cancer-specific cytotoxicity in vitro (in the presence of complement) as well as in vivo using a sever combined immunodeficiency model transplanted with human MM. Further studies showed the ability of mAb VAC69 to be specifically internalized by human MM cells, indicating its potential use for therapeutic intervention in MM by delivering drugs into cancer cells.",valid,
26614752,"Streptococcus mutans is an important cariogenic microorganism, and alternative methods for its elimination are required. Different concentrations of Baccharis dracunculifolia essential oil (EO) were tested to determine its minimal inhibitory concentration (MIC) in planktonic cultures, and this concentration was used in S. mutans biofilms. Additionally, we assessed the effect of a 0.12% chlorhexidine (CHX) and saline solution in S. mutans biofilms. The biofilms were grown in discs of composite resin for 48h and exposed to B. dracunculifolia, CHX or saline solution for 5min. The viability of the biofilms was determined by counting the colony-forming units per milliliter (CFU/ml) in agar, which was statistically significant (P<0.05). The MIC of the B. dracunculifolia EO to planktonic growth of S. mutans was 6%. In biofilms of S. mutans clinical isolates, B. dracunculifolia EO (6%) and CHX resulted in reductions of 53.3-91.1% and 79.1-96.6%, respectively. For the biofilm formed by the S. mutans reference strain, the reductions achieved with B. dracunculifolia EO and CHX were, respectively, 39.3% and 88.1%. It was concluded that B. dracunculifolia EO showed antibacterial activity and was able to control this oral microorganism, which otherwise causes dental caries.",valid,
9549516,"A previously unrecognized neuropathy was identified in Bulgarian gypsies, and was designated hereditary motor and sensory neuropathy-Lom (HMSNL) after the town where the initial cases were found. It was subsequently identified in other gypsy communities. The disorder, which is of autosomal recessive inheritance, was mapped to chromosome 8q24. It begins consistently in the first decade of life with gait disorder followed by upper limb weakness in the second decade and, in most subjects, by deafness which is most often first noticed in the third decade. Sensory loss affecting all modalities is present, both this and the motor involvement predominating distally in the limbs. Skeletal deformity, particularly foot deformity, is frequent. Severely reduced motor nerve conduction velocity indicates a demyelinating basis, which was confirmed by nerve biopsy. The three younger patients biopsied showed a hypertrophic 'onion bulb' neuropathy. The hypertrophic changes were not evident in the oldest individual biopsied and it is likely that they had regressed secondarily to axon loss. In the eight cases in which brainstem auditory evoked potentials could be recorded, the results suggested demyelination in the eighth cranial nerve and also abnormal conduction in the central auditory pathways in the brainstem. As no myelin genes are known to be located at chromosome 8q24, the disorder may involve a gene for a novel myelin protein or be due to an abnormality of axon-Schwann cell signalling.",valid,
11497739,"The parity of a bit string of length N is a global quantity that can be efficiently computed using a global counter in O(N) time. But is it possible to find the parity using cellular automata with a set of local rule tables without using any global counter? Here, we report a way to solve this problem using a number of r=1 binary, uniform, parallel, and deterministic cellular automata applied in succession for a total of O(N2) time.",valid,
34833432,"Breast implantation (BI) is the most common plastic surgery worldwide performed among women. Generally, BI is performed both in aesthetic and oncoplastic procedures. Recently, the prevalence of breast implant-associated anaplastic large cell lymphoma (BIA-ALCL) or breast implant illness (BII) has aroused concerns. As a result, several countries, like Australia, Korea or the United Kingdom, introduced national registries dedicated to the safety and quality of BI surgeries. This narrative review aimed to focus on the clinical challenges, management and the current state of knowledge of BI. Both short and long-term outcomes of BI are determined by various alternatives and differences, which surgeons must consider during the planning and performing breast augmentation along with further complications or risk of reoperation. Proper preoperative decisions and aspects of surgical technique emerged to be equally important. The number of performed breast reconstructions is increasing, providing the finest aesthetic results and improving patient's quality of life. Choice of prosthesis varies according to individual preferences and anatomical variables. A newly diagnosed cases of BIA-ALCL with lacking data on prevention, diagnosis, and treatment are placing it as a compelling medical challenge. Similarly, BII remains one of the most controversial subjects in reconstructive breast surgery due to unspecified diagnostic procedures, and recommendations.",valid,8625629
22573596,"Plasmodium knowlesi infection with low parasitemia presents a diagnostic challenge, as rapid diagnostic tests are often negative and identification to the species level by microscopy is difficult. P. knowlesi malaria in a traveler is described, and real-time PCR is demonstrated to support fast and reliable diagnosis and identification to the species level.",valid,3405625
27760279,"The nitric oxide synthases (NOS) catalyze a two-step oxidation of l-arginine (Arg) to generate NO. In the first step, O",valid,5387691
28081170,"Alpha-1 adrenergic receptors mediate adaptive effects in the heart and cardiac myocytes, and a myocyte survival pathway involving the alpha-1A receptor subtype and ERK activation exists in vitro. However, data in vivo are limited. Here we tested A61603 (N-[5-(4,5-dihydro-1H-imidazol-2-yl)-2-hydroxy-5,6,7,8-tetrahydronaphthalen-1-yl]methanesulfonamide), a selective imidazoline agonist for the alpha-1A. A61603 was the most potent alpha-1-agonist in activating ERK in neonatal rat ventricular myocytes. A61603 activated ERK in adult mouse ventricular myocytes and protected the cells from death caused by the anthracycline doxorubicin. A low dose of A61603 (10 ng/kg/d) activated ERK in the mouse heart in vivo, but did not change blood pressure. In male mice, concurrent subcutaneous A61603 infusion at 10 ng/kg/d for 7 days after a single intraperitoneal dose of doxorubicin (25 mg/kg) increased survival, improved cardiac function, heart rate, and cardiac output by echocardiography, and reduced cardiac cell necrosis and apoptosis and myocardial fibrosis. All protective effects were lost in alpha-1A-knockout mice. In female mice, doxorubicin at doses higher than in males (35-40 mg/kg) caused less cardiac toxicity than in males. We conclude that the alpha-1A-selective agonist A61603, via the alpha-1A adrenergic receptor, prevents doxorubicin cardiomyopathy in male mice, supporting the theory that alpha-1A adrenergic receptor agonists have potential as novel heart failure therapies.",valid,5231318
33348913,Chilling injury (CI) is a postharvest disorder occurring in the fruit of cold-sensitive,valid,7766470
29053434,"Glutaraldehyde (GLA) has been used to crosslink bioprosthetic heart valve (BHVs) tissues to enhance their stability, besides ensuring a satisfactory degree of immunological tolerance. Unfortunately, GLA fixation does not guarantee a complete tissue biocompatibility of BHVs in currently used devices. The interaction between preformed human anti-alpha-Gal antibody and alpha-Gal antigens promotes the calcification of GLA-treated alpha-Gal-positive tissue. Recently, an alarming correlation between the presence of the alpha-Gal epitope and a premature BHVs degeneracy was reported. This article presents the results of a novel treatment called FACTA, for the inactivation of the alpha-Gal epitopes in porcine aortic valve tissue and commercial BHVs.",valid,
20109441,"Insecticides directed against acetylcholinesterase (AChE) are facing increased resistance among target species as well as increasing concerns for human toxicity. The result has been a resurgence of disease vectors, insects destructive to agriculture, and residential pests. We previously reported a free cysteine (Cys) residue at the entrance to the AChE active site in some insects but not higher vertebrates. We also reported Cys-targeting methanethiosulfonate molecules (AMTSn), which, under conditions that spared human AChE, caused total irreversible inhibition of aphid AChE, 95% inhibition of AChE from the malaria vector mosquito (Anopheles gambia), and >80% inhibition of activity from the yellow fever mosquito (Aedes aegypti) and northern house mosquito (Culex pipiens). We now find the same compounds inhibit AChE from cockroaches (Blattella germanica and Periplaneta americana), the flour beetle (Tribolium confusum), the multi-colored Asian ladybird beetle (Harmonia axyridis), the bed bug (Cimex lectularius), and a wasp (Vespula maculifrons), with IC(50) values of approximately 1-11muM. Our results support further study of Cys-targeting inhibitors as conceptually novel insecticides that may be free of resistance in a range of insect pests and disease vectors and, compared with current compounds, should demonstrate much lower toxicity to mammals, birds, and fish.",valid,
8581152,"A case of mixed connective tissue disease (MCTD) in a female with positive ribonucleoprotein antibody and overlapped manifestations of systemic lupus erythematosus and dermatomyositis is presented. During the last 9 years of her 13 year clinical course, she repeatedly manifested abdominal distension, pneumoperitoneum and malabsorption syndrome. She died, aged 54 years, of respiratory failure secondary to pulmonary compression from marked abdominal distention. Autopsy revealed esophageal fibrosis with ulceration and the typical appearance of pneumatosis cystoides intestinalis (PCI), in association with atrophy and fibrosis of the inner circular muscle layer of the small bowel. The association of PCI with MCTD is reviewed briefly.",valid,
32770070,Synapse and dendritic spine loss induced by amyloid-β oligomers is one of the main hallmarks of the early phases of Alzheimer's disease (AD) and is directly correlated with the cognitive decline typical of this pathology. The p75 neurotrophin receptor (p75,valid,7415136
38473922,"Load-bearing biological tissues, such as cartilage and muscles, exhibit several crucial properties, including high elasticity, strength, and recoverability. These characteristics enable these tissues to endure significant mechanical stresses and swiftly recover after deformation, contributing to their exceptional durability and functionality. In contrast, while hydrogels are highly biocompatible and hold promise as synthetic biomaterials, their inherent network structure often limits their ability to simultaneously possess a diverse range of superior mechanical properties. As a result, the applications of hydrogels are significantly constrained. This article delves into the design mechanisms and mechanical properties of various tough hydrogels and investigates their applications in tissue engineering, flexible electronics, and other fields. The objective is to provide insights into the fabrication and application of hydrogels with combined high strength, stretchability, toughness, and fast recovery as well as their future development directions and challenges.",valid,10932079
