PMID,Abstract,Status
19800044,"Many studies have investigated mechanically induced bone formation in mice and rats by applying loads to the long bones, and measuring changes in periosteal cortical bone apposition rates. However, the results are difficult to compare among each other because the loading schemes are generally different. The purpose of the present study was to develop a theoretical framework for evaluating the mechanical stimulus based on the bone daily strain stimulus, which is a function of loading cycles and bone strains. The daily strain stimulus would act as a single unifying parameter for directly comparing data from existing in vivo experiments, and is applied here to twenty previous rat and mouse studies. To calculate the daily strain stimulus, we determined the periosteal daily strain stimulus necessary for bone maintenance (xi(peri,0)) and the strain-cycle weighting exponent (m). In the first approach, we applied data from Rubin and Lanyon's bone maintenance studies. We calculated xi(peri,0) to be 2793 microstrain/day, and m to be 4.5. In the second approach, we used Fritton et al. 's strain gage recordings to calculate xi(peri,0) to be 1496 microstrain/day, and used an m value of 11.88, equal to human bone compressive fatigue properties. Fatigue data provided physiological relevance, and was useful for applying an established remodeling theory to in vivo studies. For both approaches, xi(peri,0) was below the fracture level. We then analyzed the applied strains, cycles, and periosteal bone apposition rates from the previous studies. The range of daily strain stimuli calculated using the first approach was much larger than the range using the second approach (2793-17312 microstrain/day compared to 1496-7681 microstrain/day). None of the studies applied a daily strain stimulus above the complete fatigue failure level, but some studies applied loading that could result in major fatigue microdamage. Bone apposition rates generally increased with increasing daily strain stimulus, which was consistent with previous theoretical models. The results suggest that the daily strain stimulus may be a reasonable first approximation for predicting bone apposition rates in a consistent manner. The use of the daily strain stimulus may be helpful for improving the design of future bone loading studies.",valid
38260816,"The FIFA World Cup is not only the most lucrative athletic event globally, but it also functions as a platform for promoting peace owing to FIFA's new vision. Nevertheless, the determinants of TV viewership ratings, especially in the Chinese market, which is a critical revenue stream for FIFA TV broadcasting, are still unsolved. Using a distributional regression, this study aimed to quantify the dynamics of viewership ratings for the FIFA World Cup 2022 in mainland China. The CCTV viewership ratings were modeled using 12 covariables related to Chinese TV consumer behavior. Given the data structure, a Logit Normal regression model was chosen to fit the location and dispersion parameters of viewership ratings to explanatory variables. In the fitted heteroscedastic model, the viewership ratings dynamics in mainland China were driven by the match kick-off time: Time- and team-sensitive strategies are proposed to aid in crafting uncertainty-suppressing business decisions for the FIFA World Cup 2026. Ultimately, in the more insecure 2020s, a broader live coverage of the FIFA World Cup would be invaluable for promoting peace.",valid
12804395,"Fracture of the distal radius is a common clinical problem particularly in elderly white women with osteoporosis. To determine the most appropriate conservative treatment for fractures of the distal radius in adults. We searched the Cochrane Musculoskeletal Injuries Group specialised register (November 2002), the Cochrane Central Register of Controlled Trials (The Cochrane Library, Issue 1, 2003), MEDLINE (1966 to January week 1 2003), EMBASE (1988 to 2003 Week 3), CINAHL (1982 to December week 4 2002), the National Research Register (up to Issue 4, 2002), PEDro, conference proceedings and reference lists of articles. No language restrictions were applied. Randomised or quasi-randomised clinical trials involving skeletally mature patients with a fracture of the distal radius, which compared commonly applied conservative interventions for fracture fixation. These included the application of an external support (plaster cast or brace) and fracture manipulation. All trials, judged as fitting the selection criteria by both reviewers, were independently assessed by both reviewers for methodological quality. Data were extracted for anatomical, functional and clinical, including complications, outcomes. The trials were grouped into categories relating to manipulation of displaced fractures; use and extent, including forearm position, of immobilisation; use of braces; different casting materials and techniques; and duration of immobilisation. Although quantitative data from some trials are presented, the lack of good quality trials and trial heterogeneity inhibited pooling of results. Three trials were newly included in this update. In all, there are 36 trials, involving a total of 4114 mainly female and older patients, meeting the inclusion criteria for this review. Comprehensive details of the individual trials are provided in tabular form, and their results, grouped as indicated above, have been presented in text and analyses tables. The poor quality and heterogeneity in terms of patient characteristics, interventions compared and outcome measurement, of the included trials meant that no meta-analyses were undertaken. There remains insufficient evidence from randomised trials to determine which methods of conservative treatment are the most appropriate for the more common types of distal radial fractures in adults. Therefore, at present, practitioners applying conservative management should use an accepted technique with which they are familiar, and which is cost-effective from the perspective of their provider unit. Patient preferences and circumstances, and the risk of complications should also be considered. Prioritising research questions to clarify the most appropriate conservative treatment for this common fracture is warranted. Researchers should differentiate between extra-articular and intra-articular, and non-displaced and displaced fractures, ascertain patient preferences, and agree a core outcome data set.",valid
30276622,"To calculate the specific binding ratio (SBR) appropriately in dopamine transporter (DAT) imaging, a method for extracting the striatal volume of interest (VOI) was developed. This study included 200 patients (72 ± 10 years) who were suspected of parkinsonian syndromes (PS) or dementia with Lewy body (DLB). The patients were divided into three groups of PS with dopaminergic degeneration, DLB and non-PS after [ The mean SBR values for the PS and DLB groups were significantly different from that of the non-PS group with both methods. The coefficients of variation of the SBR were significantly smaller with the proposed method compared with those of SBR Our new method for SBR calculation in the FP-CIT SPECT showed less coefficients of variation with high reproducibility, which would be useful for clinical diagnosis and in assessing the severity of diseases in follow-up studies.",valid
37441314,"The Patient Activation Measure (PAM) assesses the knowledge, skills and confidence of patients to manage their health, and has been consistently used as an outcome measure of health interventions. Using the PAM to tailor interventions to a patient's activation level is less understood. This literature review aimed to examine evidence for interventions using the PAM to tailor care for patients with chronic conditions, including enablers and barriers to implementation, and the impact on quality of care. A scoping review methodology was used to identify literature reporting on PAM-tailored interventions. The Insignia Health website and Medline database were searched. Included papers were published in English from 2004 to 2017, from Organisation for Economic Cooperation and Development countries, included adult patients with chronic conditions, and a PAM-tailored intervention. Eligible full-text papers were assessed against the inclusion criteria. Data were extracted into tables and summarised to assess the key findings, recurring themes and differences across papers. Twenty-one papers describing the use of PAM-tailored interventions (n=21) were identified. Interventions included motivational interviewing, health coaching, self-management planning and risk profile assessment. The perceived value and function of the PAM held by organisations, clinicians and patients influenced implementation and use. Evidence for the impact of PAM-tailored interventions on quality of care was limited. The PAM is being used to tailor a range of interventions for patients with chronic conditions. Clinician perceptions and understanding about the PAM's value and purpose influenced implementation. Further research is needed about how PAM-tailored interventions can be integrated into clinical practice, and guide the patient-clinician interaction, in ways that improve the quality of patient care.",valid
24436009,"Isolating the short-term storage component of working memory (WM) from the myriad of associated executive processes has been an enduring challenge. Recent efforts have identified patterns of activity in visual regions that contain information about items being held in WM. However, it remains unclear (1) whether these representations withstand intervening sensory input and (2) how communication between multimodal association cortex and the unimodal perceptual regions supporting WM representations is involved in WM storage. We present evidence that the features of a face held in WM are stored within face-processing regions, that these representations persist across subsequent sensory input, and that information about the match between sensory input and a memory representation is relayed forward from perceptual to prefrontal regions. Participants were presented with a series of probe faces and indicated whether each probe matched a target face held in WM. We parametrically varied the feature similarity between the probe and target faces. Activity within face-processing regions scaled linearly with the degree of feature similarity between the probe face and the features of the target face, suggesting that the features of the target face were stored in these regions. Furthermore, directed connectivity measures revealed that the direction of information flow that was optimal for performance was from sensory regions that stored the features of the target face to dorsal prefrontal regions, supporting the notion that sensory input is compared to representations stored within perceptual regions and is subsequently relayed forward. Together, these findings indicate that WM storage operations are carried out within perceptual cortex.",valid
7686535,"Recent molecular genetic studies have provided new insights into the structure and function of 2 of the major integral membrane proteins of myelin--the proteolipid protein (PLP) and protein zero (P0)--and have uncovered a third such protein--PMP22/gas3. The rumpshaker mouse has been shown to carry a point mutation in the PLP gene that uncouples a deleterious effect on CNS myelin assembly, which these mice exhibit, from oligodendrocyte degeneration and cell death, which they do not. The developmental importance of the P0 protein in PNS myelination has been dramatically demonstrated by the analysis of loss-of-function mutations engineered through the expression of antisense RNA and through the insertional inactivation of the P0 gene by homologous recombination in embryonic stem cells and the generation of P0-deficient mice. The cloned promoter of the P0 gene has been shown to drive quantitative, Schwann cell-specific expression of heterologous genes in transgenic mice. The PMP22/gas3 gene, previously cloned from fibroblast cell lines, has been found to encode an axonally regulated Schwann cell protein that is assembled into PNS myelin. Importantly, this gene appears to be the target of mutations that result in the Trembler alleles in mice, and in Charcot-Marie-Tooth disease Type 1a, the most common inherited peripheral neuropathy in humans.",valid
22219854,"In the crystal structure of the title complex, [Ni(C(6)H(7)NO)(3)](PF(6))(C(2)F(3)O(2)), the Ni(II) ion is in a slightly distorted octa-hedral NiO(3)N(3) coordination geometry with each of the three N and three O atoms in a meridional coordination. In the crystal, the complex mol-ecules and the trifluoro-acetate anions are connected via O-H⋯O hydrogen bonding into layers parallel to the ab plane.",valid
15011893,"Although proton pump inhibitors are highly effective in raising intragastric pH, there still remains a small group of patients who resist acid suppression. A high dose of omeprazole has been shown to reduce rebleeding rate in patients with bleeding peptic ulcers after endoscopic therapy. The primary objective of this study was to assess the incidence of peptic ulcer bleeding patients who were resistant to intravenous omeprazole. The secondary objective was to evaluate the relationship between intragastric pH and rebleeding rate in studied patients after successful endoscopic therapy. Between Oct. 1996 and Aug. 1999, 88 bleeding peptic ulcer patients who had obtained initial hemostasis with endoscopic therapy were enrolled in this study. In these patients, 40 mg of omeprazole was given as intravenous bolus followed by 40 mg intravenously every 6 h for 3 days. Thereafter, omeprazole was given 20 mg orally once daily for 2 months. The intragastric pH was recorded for 24 hours after the first dose of omeprazole. The occurrence of rebleeding was observed for 14 days. The mean intragastric pH value of these 88 patients was 6.07, (95% CI: 5.91-6.23). Four patients (5%) were found to have omeprazole resistance (pH < 4.0, 50% of the time). By the 3rd days after entering the study, more patients with a mean pH < 6 rebled (5/25 vs. 3/63, p<0.05). About five percent of patients with peptic ulcer bleeding respond poorly to intravenous omeprazole. Rebleeding rate is higher in patients with a mean intragastric pH of less than 6.",valid
28421468,"Preference for a larger-variable ""risky"" option over a smaller-reliable ""safe"" option often depends upon the likelihood that the risky option will deliver a sufficiently sized reward to have an equivalent or superior expected value. However, preference for the risky option has been shown to increase under conditions where informative stimuli signaling the outcome of a risky choice is included between the choice and the outcome and this risk-prone preference persists even when the risky option has a lower expected value than the alternative safe option. In the present study, rhesus macaques chose between a risky option and a safe option across two experimental phases to determine whether the outcome signal affected the degree of preference for the risky option. Overall, six out of seven macaques showed a greater preference for the risky option in the signaled condition than in the unsignaled condition. The macaques' risky choices were sensitive to the expected value of the risky option and the signaled condition produced a general increase in risky choices independently of the expected value of the risky outcome. Overall, these results are consistent with those obtained with other animals, and this may relate to a process where animals show a biased preference for ""good news."" This process may model some of the relevant factors that explain the psychology of gambling in humans.",valid
20451824,"This study evaluated the effect of bone quality on the stability of and stress in the artificial temporomandibular joint (TMJ) condylar prosthesis as well as on the stress and strain distributions in the bone. Three-dimensional finite element models of the mandible and an artificial TMJ condylar prosthesis using 3 screws were established. Four types of bone were modeled by varying the elastic modulus of cancellous bone. Increasing the bone quality from type IV to type I reduced the maximum relative micromotion between implant and bone, maximum von Mises stresses in the implant and surrounding cortical bone, and maximum von Mises strain in the surrounding cancellous bone by 17.5%, 10.5%, 12.0%, and 39.4%, respectively. The bone quality of the mandible has only a minor effect on the stability of and stress in an artificial TMJ implant and cortical bone, but it greatly affects the microstrain in cancellous bone.",valid
32593388,"Window settings to rescale and contrast stretch raw data from radiographic images such as Computed Tomography (CT), X-ray and Magnetic Resonance images is a crucial step as data pre-processing to examine abnormalities and diagnose diseases. We propose a distant-supervised method for determining automatically the best window settings by attaching a window estimator module (WEM) to a deep convolutional neural network (DCNN)-based lesion classifier and training them in conjunction. Aside from predicting a flexible window setting for each raw image, we statistically identify the top four window settings by calculating the mean and standard deviations for the entire dataset. Images are scaled on each of the top settings estimated by WEM and following lesion classifiers are subsequently trained. We study the effects of only using the flexible window, the single fixed window as either a known default window used by radiologists or an estimated mean value, and two different approaches to combine results from the top window settings to improve the detection of intracranial hemorrhage (ICH) from brain CT images. Experimental results showed that using the top four window settings identified from the window estimator module and combining the results had the best performance.",valid
33024133,"In an adjoining publication, we demonstrated the novel technique to harvest soil gas of natural origin as a highly efficient source of",valid
30099058,"The analyses of the amino acid sequences of proteins provide valuable information regarding the structure and function of the protein. A comparatively new approach is the alignment-free sequence comparisons. To-date most, if not all, sequence analysis techniques are used to find out the sequence homologies to measure the evolutionary relatedness among the species. However, a still untouched avenue in the field of sequence analyses is to build a comparative estimate of the sequence similarities between unrelated protein sequences from and within a single species. In this work, we tried to develop an alignment-free scoring method to study sequences from different proteins belonging to humans to identify the disease-associations of the sequences. A total of 52 protein sequences were analyzed. There were 599 reported polymorphic sites and 802 (708 polymorphic and 94 disease-associated) Single Amino acid Variants (SAVs) in the training data set. For cross-validation purposes, another set of 62 protein sequences (26 enzymes, 16 Membrane-bound Enzymes and 20 Membrane-bound Proteins), with a total of 261 reported polymorphic sites and 799 (291 polymorphic and 508 disease-associated) SAVs, were used. A negative correlation was observed for both training and cross-validation data set between percentage of reported disease-associated SAVs with a ratio of (polymorphic site : protein length). A new scoring pattern was also developed that would take into account the ratio of polymorphic site and protein length by counting the number of polymorphic amino acids and the total numbers of amino acids in proteins.",valid
2876489,"Human renal proximal tubular cells were exposed to gentamicin (0, 0.1, 0.5, 1.0, 5.0, 10.0 mg/ml medium) for 3, 7, 10, and 14 days. Cells were counted and cell viability was estimated by lactate dehydrogenase release. In addition, brush border-associated (gamma-glutamyltransferase) and lysosomal (acid phosphatase, N-acetyl-beta-glucosaminidase, and sphingomyelinase) enzyme activities were measured (0.01, 1.0, 3.3 mg/ml gentamicin for 3, 7, 10 and 14 days). The number of cells did not change significantly after gentamicin treatment. Cell viability, however, significantly decreased after 3 and 7 days exposure to 5 and 10 mg/ml gentamicin. Total lactate dehydrogenase activity was significantly decreased at 7, 10, and 14 days exposure to gentamicin greater than or equal to 5.0 mg/ml. gamma-Glutamyltransferase, acid phosphatase, and sphingomyelinase were decreased at 3, 7, and 10 days exposure to gentamicin greater than or equal to 1.0 mg/ml. Continued exposure to gentamicin less than or equal to 1.0 mg/ml appeared to have little or no effect on the activity of these enzymes at 14 days. N-Acetyl-beta-glucosaminidase activity, in contrast, was elevated (120-140% control) in the gentamicin-treated (greater than or equal to 1.0 mg/ml) groups at all time periods studied. Thus, gentamicin exposure resulted in changes in some of the enzyme activities in human renal proximal tubular cell cultures, but longer exposure (14 days) to gentamicin (less than or equal to 1.0 mg/ml) resulted in a return to control levels of some activities.",valid
7734331,"Cocaine is reported to produce either periportal or mid-zonal necrosis in mice pretreated with the enzyme inducer phenobarbitone (James et al. 1987; Powell et al. 1991; Charles & Powell 1992). Dose-response and time course experiments were performed in phenobarbitone treated male DBA/2Ha mice to study the pathogenesis of this unusual cocaine induced lesion. An increase in the dose of cocaine from 60 to 90 or 120 mg/kg produced more extensive and severe periportal and linking portal damage and elevated plasma aspartate (AST) and alanine (ALT) aminotransferases in a dose dependent manner. Scattered hepatocyte degeneration began at the edge of the periportal region and was detectable by electron microscopy within 30 minutes of administration of 60 mg/kg of cocaine, with conspicuous disorganization of the endoplasmic reticulum being one of the earliest changes. Significant elevations of plasma AST and ALT were observed 3 hours after cocaine administration and were sustained for 12 hours, at which time progressive hepatocyte damage had developed into a network of confluent necrosis at the periphery of the periportal region. The rapidity of organelle derangement and subsequent cell death, and absence of any effect on total cytochrome P-450 or FAD-mono-oxygenase levels, appear to distinguish this periportal lesion from previous reports of cocaine induced centrilobular necrosis in non-enzyme induced mice, suggesting that the two types of damage may develop by different mechanisms. The observation that periportal lesions commence at the periphery of the periportal area, progressing portalwards with increasing dose and time, offers an explanation for the previously conflicting reports of cocaine induced mid-zonal and/or periportal lesions in phenobarbitone treated mice.",valid
25917528,"Five diarylethene photochromic derivatives, the structures of which incorporate a central benzothiophene unit, a left-hand thiazole group, and a right-hand benzothiophene group, have been prepared. The compound with a thiazole unit with no substituent on the reaction-center carbon atom reveals an unprecedented transformation upon light irradiation. When the 4-position of thiazole is protected by a methyl group, the compounds show high photosensitivity and photochromic properties. In this case, light irradiation affords new compounds with [5]helicene structures featuring the highest redshifted absorption maxima reported to date.",valid
20847698,"The Mayer-Rokitansky-Küster-Hauser syndrome is defined as congenital aplasia of müllerian ducts derived structures in females with a normal female chromosomal and gonadal sex. Most cases with Mayer-Rokitansky-Küster-Hauser syndrome are sporadic, although familial cases have been reported. The genetic basis of Mayer-Rokitansky-Küster-Hauser syndrome is largely unknown and seems heterogeneous, and a small number of cases were found to have mutations in the WNT4 gene. The aim of this study was to identify possible recurrent submicroscopic imbalances in a cohort of familial and sporadic cases with Mayer-Rokitansky-Küster-Hauser syndrome. Multiplex ligation-dependent probe amplification was used to screen the subtelomeric sequences of all chromosomes in 30 patients with Mayer-Rokitansky-Küster-Hauser syndrome (sporadic, n = 27 and familial, n = 3). Segregation analysis and pyrosequencing were applied to validate the MLPA results in the informative family. Partial duplication of the Xpter pseudoautosomal region 1 containing the short stature homeobox (SHOX) gene was detected in five patients with Mayer-Rokitansky-Küster-Hauser syndrome (familial, n = 3 and sporadic, n = 2) and not in 53 healthy controls. The duplications were not overlapping, and SHOX was never entirely duplicated. Haplotyping in the informative family revealed that SHOX gene duplication was inherited from the unaffected father and was absent in two healthy sisters. Partial duplication of SHOX gene is found in some cases with both familial and sporadic Mayer-Rokitansky-Küster-Hauser type I syndrome.",valid
