PMID,Abstract,Status
36295862,Excessive gestational weight gain (GWG) is associated with adverse pregnancy outcomes. This metabolome-wide association study aimed to identify metabolomic markers for GWG. This longitudinal study included 39 Black and White pregnant women with a prepregnancy body mass index (BMI) of ≥ 25 kg/m,valid
19900279,"Worldwide, coral reefs are in decline due to a range of anthropogenic disturbances, and are now also under threat from global climate change. Virtually nothing is currently known about the genetic factors that might determine whether corals adapt to the changing climate or continue to decline. Quantitative genetics studies aiming to identify the adaptively important genomic loci will require a high-resolution genetic linkage map. The phylogenetic position of corals also suggests important applications for a coral genetic map in studies of ancestral metazoan genome architecture. We constructed a high-resolution genetic linkage map for the reef-building coral Acropora millepora, the first genetic map reported for any coral, or any non-Bilaterian animal. More than 500 single nucleotide polymorphism (SNP) markers were developed, most of which are transferable in populations from Orpheus Island and Great Keppel Island. The map contains 429 markers (393 gene-based SNPs and 36 microsatellites) distributed in 14 linkage groups, and spans 1,493 cM with an average marker interval of 3.4 cM. Sex differences in recombination were observed in a few linkage groups, which may be caused by haploid selection. Comparison of the coral map with other metazoan genomes (human, nematode, fly, anemone and placozoan) revealed synteny regions. Our study develops a framework that will be essential for future studies of adaptation in coral and it also provides an important resource for future genome sequence assembly and for comparative genomics studies on the evolution of metazoan genome structure.",valid
16638914,"To report a case of propofol-induced priapism. A 17-year-old male receiving propofol for induction of anesthesia during a cardiac ablation procedure developed priapism that required medical intervention and discontinuation of propofol. The priapism developed after a total propofol dose of 550 mg, lasted for 2 hours, and resolved immediately following medical intervention. The following day, the patient underwent a transesophageal echocardiogram and received a total propofol dose of 40 mg throughout the procedure. He again developed priapism, which resolved within one hour without medical intervention. Priapism experienced by this patient is considered to be drug-induced because of the temporal relationship, recurrence with rechallenge, and dose-response relationship. Using the Naranjo probability scale, we determined that propofol was a highly probable causative agent of priapism in this patient. Although, as of April 4, 2006, this adverse effect has not been previously reported, there is a strong correlation of propofol to priapism in this patient. Clinicians should be aware of this adverse effect.",valid
1843517,"Aortic input impedance and hydraulic power were measured in patients with ventricular septal defect (VSD). Aortic input impedance consists of the characteristic impedance (index of aortic distensibility) and the terminal impedance (index of peripheral resistance) which represent the left ventricular hydraulic load. The external left ventricular hydraulic power consists of steady power which transmits blood to the peripheral vasculature and pulsatile power which is converted into heat energy. The ratio of pulsatile to total power indicates the efficiency of the arterial system. The present study was carried out on 6 patients with VSD whose Qp/Qs was greater than 2.0 (VSD group) and 10 age-matched controls who had a history of Kawasaki disease without coronary complications at the time of cardiac catheterization (control group). Descending aortic pressure and flow velocity were measured simultaneously at the level of the 10th thoracic vertebra using a multisensor-catheter. Impedance data were calculated from Fourier analysis of these findings. Characteristic impedance did not differ between the 2 groups. Terminal impedance was higher in the VSD group with the increasing peripheral resistance and vascular afterload. The pulsatile component of external hydraulic power was similar in both groups, however, the steady component was lower in the VSD group indicating a higher ratio of pulsatile to total power in the VSD group. In conclusion, vascular afterload was increased and the efficiency of the arterial system was reduced in patients with VSD having large shunts.",valid
6793087,"A dual-label isotope technique was used to study the effects of aldosterone upon the incorporation of amino acids into proteins of the in vitro toad urinary bladder. Following labeling, the mucosal cells were disaggregated and the mitochondria-rich and granular cells were separated. Proteins with an elevated isotope ratio were found in a plasma membrane fraction (170 000, 110 000 and 85 000 daltons) and in the cytosol (36 000 and 6 000 daltons) of the preparations enriched in mitochondria-rich cells. These effects of aldosterone were blocked by cycloheximide. There was no evidence that aldosterone had induced the incorporation of labeled amino acids into carbonic anhydrase isolated from the soluble fraction by affinity chromatography. The results suggest that the physiologic response of the toad bladder to aldosterone is related to the synthesis of both soluble and plasma membrane proteins.",valid
32887904,"The neurotransmitter noradrenaline (NA) mediates arousal, attention and mood, and exerts anti-inflammatory and neuroprotective effects. Alterations of monoamine signalling were reported in multiple sclerosis (MS) and psychiatric illness and may account for the high prevalence of comorbid depression and fatigue in MS patients. We assessed central noradrenaline transporter (NAT) availability using positron emission tomography (PET) and the NAT selective radiotracer S,S-[",valid
25990818,"The American-Canadian psychologist Mary Ainsworth (1913-1999) developed the Strange Situation Procedure (SSP) to measure mother-child attachment and attachment theorists have used it ever since. When Ainsworth published the first results of the SSP in 1969, it seemed a completely novel and unique instrument. However, in this paper we will show that the SSP had many precursors and that the road to such an instrument was long and winding. Our analysis of hitherto little-known studies on children in strange situations allowed us to compare these earlier attempts with the SSP. We argue that it was the combination of Ainsworth's working experience with William Blatz and John Bowlby, her own research in Uganda and Baltimore, and the strong connection of the SSP with attachment theory, that made the SSP differ enough from the other strange situation studies to become one of the most widely used instruments in developmental psychology today.",valid
16604499,"To investigate the correlation between intercellular adhesion molecule1 (ICAM1) gene K469E polymorphism and coronary heart disease(CHD) in Han Chinese population. Using the methods of polymerase chain reaction-restrictive fragment length polymorphism (PCR-RFLP), 173 CHD patients and 141 controls were analyzed for the polymorphism, genotype and allele distribution of ICAM1 gene K469E. The distribution of ICAM1 genotypes was in Hardy-Weinberg equilibrium. The frequency of KK genotype in CHD group was significantly higher than that in control (64.2% vs 48.9%, P<0.01). Similarly, the frequency of K allele in CHD group was significantly higher than that in control (79.2% vs 69.9%, P<0.01). With Logistic Regression Analysis ruling out the influences of age, gender and other CHD risk factor, the homozygous individual with KK genotype was 2.35 folds of KE or EE genotype one suffering from CHD (OR: 2.35, 95%CI: 1.03-5.36, P<0.05). ICAM1 gene K469E polymorphism is associated with CHD risk of Han Chinese population, the K allele may serve as a genetic risk factor of coronary heart disease.",valid
11027283,"Chloroplast translation is mediated by nucleus-encoded factors that interact with distinct cis-acting RNA elements. A U-rich sequence within the 5' untranslated region of the psbD mRNA has previously been shown to be required for its translation in Chlamydomonas reinhardtii. By using UV cross-linking assays, we have identified a 40-kDa RNA binding protein, which binds to the wild-type psbD leader, but is unable to recognize a nonfunctional leader mutant lacking the U-rich motif. RNA binding is restored in a chloroplast cis-acting suppressor. The functions of several site-directed psbD leader mutants were analyzed with transgenic C. reinhardtii chloroplasts and the in vitro RNA binding assay. A clear correlation between photosynthetic activity and the capability to bind RNA by the 40-kDa protein was observed. Furthermore, the data obtained suggest that the poly(U) region serves as a molecular spacer between two previously characterized cis-acting elements, which are involved in RNA stabilization and translation. RNA-protein complex formation depends on the nuclear Nac2 gene product that is part of a protein complex required for the stabilization of the psbD mRNA. The sedimentation properties of the 40-kDa RNA binding protein suggest that it interacts directly with this Nac2 complex and, as a result, links processes of chloroplast RNA metabolism and translation.",valid
12110526,"Mammalian preimplantation embryos experience a critical switch from an oxidative to a predominantly glycolytic metabolism. In this study, the change in nutrient metabolism between the 2-cell and blastocyst stages was followed by measuring single embryo concentrations of tricarboxylic acid (TCA) cycle and glycolytic metabolites with microfluorometric enzymatic cycling assays. When the normal values were established, further changes that occur as a result of the induction of apoptosis by exposure to high-glucose conditions were examined. From the 2-cell to the blastocyst stage, the embryos experienced an increase in TCA metabolites and a dramatic increase in fructose 1,6-bisphosphate (FBP). The high TCA metabolites may result from accumulation of substrate due to a slowing of TCA cycle metabolism as glycolysis predominates. Embryos exposed to elevated glucose conditions experienced significantly lower FBP, suggesting decreased glycolysis, significantly higher pyruvate, suggesting increased pyruvate uptake by the embryos in response to decreased glycolysis, and increased TCA metabolites, suggesting an inability to oxidize the pyruvate and a slowing of the TCA cycle. We speculate that the glycolytic changes lead to dysfunction of the outer mitochondrial membrane that results in the abnormal TCA metabolite pattern and triggers the apoptotic event.",valid
36710858,"Prohexadione calcium (Pro-Ca), as a growth retardant, can effectively alleviate the damage of salt stress to plants. In order to explore the effects of NaCl stress on the physiological characteristics and panicle traits of rice plants as well as the alleviating effect of Pro-Ca at the booting stage, we performed pot experiments on two rice cultivars: conventional rice '",valid
6978986,"Computerized tomography is acquiring an increasingly important role in the radiographic assessment of the temporal bone. In the latest generation of CT scanners, spacial resolution has been reduced to 0.1 cu mm and slice thickness to 1.5 mm. The main advantages of computerized tomography in comparison to multidirectional tomography are the improved contrast of the images and above all the clear demonstration of soft tissue structures and masses within or adjacent to the temporal bone. The following three applications of computerized tomography will be discussed: 1. Evaluation of intratemporal soft tissue masses. Computerized tomography allows differentiation of fluid filled from solid masses and vascular tumors. 2. Assessment of lesions extending outside the temporal bone or into the temporal bone from adjacent structures. In these cases CT will demonstrate the temporal bone involvement and the presence and extension of the intra or extra cranial component of the lesion. 3. Study of the cerebellopontine angle. Computerized tomography with infusion and combined with pneumocisternography comprise the procedure of choice for the diagnosis of acoustic neuromas and other lesions occurring in this area.",valid
27206312,"A Grey parrot, Griffin (Psittacus erithacus), previously taught English labels for various colors and shapes with respect to three-dimensional (3D) stimuli, was tested on his ability to transfer to very different two-dimensional (2D) images consisting of modal and amodal completion stimuli. For modal completion (aka subjective contours), Kanizsa figures were constructed using black 'pac-men' to form regular polygons on colored paper. For amodal completion, portions of variously colored regular 2D polygons were occluded by black circles or other black figures. For each task, Griffin provided a vocal English shape label for five possible shapes designated by their vertices (one, two, three, four, six). His accuracy was high for both amodal completed figures, including probe stimuli (28/38 correct) and modally completed figures (29/38 correct), with chance=0.20. The modally completed case (i.e., Kanizsa subjective figures) is of particular importance as there are no shared image parts between training and testing stimuli. We draw several conclusions from these results. First, a surface level completion process is fully operative insofar as Griffin was able to correctly identify shapes that differed considerably from training images. Second, because parrots can generalize from shapes of real objects to drawings where original image contours were clearly absent, the data provide a compelling example of shape invariance, indicating that visual shapes are processed far beyond that of their image description. Third, parrots with a repertoire of multiple vocal responses can be rigorously tested for visual competencies, an option as yet to be tried in other experimental animals.",valid
11777091,"Nursing homes in the UK are increasingly regarded as potential rehabilitation facilities for disabled older people. To determine the current physiotherapy and occupational therapy provision to UK nursing homes. Four hundred private nursing homes in England, Scotland and Wales were selected by stratified proportional random sampling and surveyed by postal questionnaire. The response rate for the effective sample was 346/355 (97%). Only 10% of residents were in current receipt of physiotherapy, mostly through private physiotherapists employed by the nursing homes. Occupational therapy was being provided to only 3.3% of residents. Older people in nursing homes in the UK currently receive little physiotherapy and occupational therapy input and are particularly isolated from National Health Service (NHS) services.",valid
17299248,"A circadian clock controls various physiological and behavioral rhythms. In mammals, a master circadian clock exists in the suprachiasmatic nucleus of the hypothalamus, and slave oscillators can be found in most tissues. These circadian oscillations are controlled by ""clock genes"". The negative feedback loop is thought to function as a molecular mechanism of the circadian clock. It is plausible that clock genes may control lipid metabolism through so-called clock-controlled genes and that lipid metabolism-related clock-controlled genes may play important roles in the circadian change of lipid metabolism. Recently research has focused on the relationships between the clock system and lipid metabolism. In this review, we discuss the following items: 1) circadian clock system, 2) effect of the diet on clock gene expression, 3) effect of clock mutation on lipid metabolism, and 4) effect of streptozotocin-induced diabetes and ob mutation on clock gene expression and lipid metabolism. In this review we have summarized how the circadian clock affects lipid metabolism through the expression of lipid metabolism-related clock-controlled genes and at the same time discussed how abnormal metabolism of lipid affects the expression of clock genes. Further experiments are needed to elucidate the detailed mechanism of interaction between clock genes and lipid metabolisms.",valid
15053625,"Previously, we have shown that the ferryl ion ([FeIVO]2+) is easily produced from Fenton's reagent (i.e., a mixture of Fe2+ ions and H2O2 in aqueous solution), using DFT and Car-Parrinello MD calculations. To verify that the ferryl ion can indeed act as the active species in oxidation reactions with Fenton's reagent, we study in the present paper the reactivity of the ferryl ion toward an organic substrate, in particular the oxidation of methane to methanol. In the first part of this paper, we perform static DFT calculations on the reaction of CH4 with the [(H2O)5FeIVO]2+ complex in vacuo that show a strong prevalence of the oxygen-rebound mechanism over the methane coordination mechanism. This is in agreement with the static DFT results for methane oxidation by biocatalysts MMO and P450, but not with those for methane oxidation by bare metal-oxo ions, where the methane coordination mechanism prevails. The highest energy barrier in the oxygen-rebound mechanism is only 3 kcal/mol in vacuo, whereas in the methane coordination mechanism the highest barrier is 23 kcal/mol. Overall the oxidation reaction energy is downhill by 47 kcal/mol. We conclude that the ferryl ion can indeed act as the oxidative intermediate in the Fenton oxidation of organic species. In the second part of this paper, we perform a preliminary assessment of solvent effects on the oxidation by the ferryl ion in aqueous solution using the method of constrained (first principles) molecular dynamics. The free energy barrier of the H-abstraction reaction from methane by the ferryl ion (i.e., the first step in the rebound mechanism) in aqueous solution is, with 22 kcal/mol in solution, significantly higher than in vacuo. Given the fact that methane has a relatively strong C-H bond (ca. 10 kcal/mol stronger than the C-H bonds in the more typical Fenton's reagent substrates), we infer that for many organic substrates oxidation with the ferryl ion as an active intermediate may be a perfectly viable route.",valid
27488494,"Accumulating evidence indicates that oxidative stress and neurotrophins have a bidirectional relationship. In this post hoc, exploratory analysis, we investigated the association between plasma brain-derived neurotrophic factor (BDNF) levels and activities of the antioxidant enzymes glutathione peroxidase (GPx) and superoxide dismutase (SOD) in individuals with bipolar disorder (BD) and healthy controls. We measured plasma levels of BDNF and activities of GPx and SOD in individuals with BD (n=59) and healthy controls (n=26). Information related to current and past psychiatric/medical history, as well as to metabolic comorbidities, was also reported. There were negative correlations between BDNF, GPx (r=-.449, P≤.001) and GPx/SOD ratio (r=-.503, P<.001), and a positive correlation between BDNF and SOD (r=.254, P=.020). There was a moderating effect of body mass index (BMI) on the association between BDNF and GPx/SOD rate ratio [(RR)=1.002, P=.034]; interactions between impaired glucose metabolism (IGM), GPx (RR=1.016, P=.033), and GPx/SOD ratio (RR=1.026, P=.002) were also observed. These results were significant in models that included age, gender, alcohol, tobacco and medication use. There was a robust and independent correlation between peripheral BDNF and antioxidant enzyme activities in individuals with BD, which was moderated by metabolic comorbidities. These results reinforce the concept that these systems are associated and further extend knowledge of the putative effect of metabolic comorbidities in the pathophysiological substrates of BD.",valid
9577139,"The authors present a case of a 36 year old male, admitted with a 3 year history of cramping abdominal pain, fever, and transient finding of a right lower quadrant mass. The abdominal roentgenogram revealed a large opacity located on the right side of the fifth lumbar segment. The patient underwent laparotomy: an enlarged appendix was removed. The specimen had 4 calculi completely obstructing the lumen of the appendix. The diameter of calculi were 0.5 (in 3 instances) and 3 cm. The case herein described is rather uncommon, due to: 1) the rarity of multiple appendiceal calculi; 2) the size of the larger stone; 3) the inconstant finding of right lower quadrant mass; 4) the non development of acute appendicitis. Differential diagnosis involved several diseases presenting with palpable mass of the lower quadrant of the abdomen and/or laminated densities at the plain abdominal roentgenogram.",valid
28327645,"Cardio-respiratory monitoring is one of the most demanding areas in the rapidly growing, mobile-device, based health care delivery. We developed a 12-lead smartphone-based electrocardiogram (ECG) acquisition and monitoring system (called ""cvrPhone""), and an application to assess underlying ischemia, and estimate the respiration rate (RR) and tidal volume (TV) from analysis of electrocardiographic (ECG) signals only. During in-vivo swine studies (n = 6), 12-lead ECG signals were recorded at baseline and following coronary artery occlusion. Ischemic indices calculated from each lead showed statistically significant (p < 0.05) increase within 2 min of occlusion compared to baseline. Following myocardial infarction, spontaneous ventricular tachycardia episodes (n = 3) were preceded by significant (p < 0.05) increase of the ischemic index ~1-4 min prior to the onset of the tachy-arrhythmias. In order to assess the respiratory status during apnea, the mechanical ventilator was paused for up to 2 min during normal breathing. We observed that the RR and TV estimation algorithms detected apnea within 7.9 ± 1.1 sec and 5.5 ± 2.2 sec, respectively, while the estimated RR and TV values were 0 breaths/min and less than 100 ml, respectively. In conclusion, the cvrPhone can be used to detect myocardial ischemia and periods of respiratory apnea using a readily available mobile platform.",valid
22083019,"To date, the lack of a suitable human cardiac cell source has been the major setback in regenerating the human myocardium, either by cell-based transplantation or by cardiac tissue engineering. Cardiomyocytes become terminally-differentiated soon after birth and lose their ability to proliferate. There is no evidence that stem/progenitor cells derived from other sources, such as the bone marrow or the cord blood, are able to give rise to the contractile heart muscle cells following transplantation into the heart. The need to regenerate or repair the damaged heart muscle has not been met by adult stem cell therapy, either endogenous or via cell delivery. The genetically stable human embryonic stem cells (hESCs) have unlimited expansion ability and unrestricted plasticity, proffering a pluripotent reservoir for in vitro derivation of large supplies of human somatic cells that are restricted to the lineage in need of repair and regeneration. Due to the prevalence of cardiovascular disease worldwide and acute shortage of donor organs, there is intense interest in developing hESC-based therapies as an alternative approach. However, how to channel the wide differentiation potential of pluripotent hESCs efficiently and predictably to a desired phenotype has been a major challenge for both developmental study and clinical translation. Conventional approaches rely on multi-lineage inclination of pluripotent cells through spontaneous germ layer differentiation, resulting in inefficient and uncontrollable lineage-commitment that is often followed by phenotypic heterogeneity and instability, hence, a high risk of tumorigenicity (see a schematic in Fig. 1A). In addition, undefined foreign/animal biological supplements and/or feeders that have typically been used for the isolation, expansion, and differentiation of hESCs may make direct use of such cell-specialized grafts in patients problematic. To overcome these obstacles, we have resolved the elements of a defined culture system necessary and sufficient for sustaining the epiblast pluripotence of hESCs, serving as a platform for de novo derivation of clinically-suitable hESCs and effectively directing such hESCs uniformly towards clinically-relevant lineages by small molecules (see a schematic in Fig. 1B). After screening a variety of small molecules and growth factors, we found that such defined conditions rendered nicotinamide (NAM) sufficient to induce the specification of cardiomesoderm direct from pluripotent hESCs that further progressed to cardioblasts that generated human beating cardiomyocytes with high efficiency (Fig. 2). We defined conditions for induction of cardioblasts direct from pluripotent hESCs without an intervening multi-lineage embryoid body stage, enabling well-controlled efficient derivation of a large supply of human cardiac cells across the spectrum of developmental stages for cell-based therapeutics.",valid
