PMID,Abstract,Status
29053434,"Glutaraldehyde (GLA) has been used to crosslink bioprosthetic heart valve (BHVs) tissues to enhance their stability, besides ensuring a satisfactory degree of immunological tolerance. Unfortunately, GLA fixation does not guarantee a complete tissue biocompatibility of BHVs in currently used devices. The interaction between preformed human anti-alpha-Gal antibody and alpha-Gal antigens promotes the calcification of GLA-treated alpha-Gal-positive tissue. Recently, an alarming correlation between the presence of the alpha-Gal epitope and a premature BHVs degeneracy was reported. This article presents the results of a novel treatment called FACTA, for the inactivation of the alpha-Gal epitopes in porcine aortic valve tissue and commercial BHVs. Evaluation of the alpha-Gal epitope inactivation was performed through a patented ELISA test, confirmed by western blot, immunofluorescence, and immunohistochemical analyses. Investigations were also conducted to assess the in vitro propensity to trigger thrombosis, calcification, and worsening of FACTA-treated tissue. To explain the mechanism of action through which the FACTA treatment acts, a specific experimental model, based on the mass spectroscopy approach, was performed. The study confirms that GLA is able to ensure the inactivation of approximately half alpha-Gal epitopes originally present in both porcine aortic valve tissue and marketed BHVs. By subjecting tissues to the FACTA procedure, it was possible to obtain an alpha-Gal inactivation degree of about 95% alongside to a reduced propensity from 72.6% to 85.4% to the in vitro calcification for porcine aortic valve tissue and 80.5% for commercial treated BHVs. FACTA was effective in decreasing oxidative tissue damage and protecting collagen from degradation. Finally, FACTA could further mitigate or even abrogate the need for early anticoagulation therapies after BHV implantation. A novel treatment, called FACTA, is effective to produce biological tissues that are less susceptible to enzymatic and oxidative stress and structural degradation, calcification, and thrombus formation. FACTA-treated tissues display a clear improvement of their biocompatibility that is characterized by an almost complete inactivation of the alpha-Gal epitope. FACTA prevents the xenogeneic tissue antigens from reacting with the host immune system, ensuring an effective shield effect that makes the tissue surface less reactive and more biocompatible.",valid
20109441,"Insecticides directed against acetylcholinesterase (AChE) are facing increased resistance among target species as well as increasing concerns for human toxicity. The result has been a resurgence of disease vectors, insects destructive to agriculture, and residential pests. We previously reported a free cysteine (Cys) residue at the entrance to the AChE active site in some insects but not higher vertebrates. We also reported Cys-targeting methanethiosulfonate molecules (AMTSn), which, under conditions that spared human AChE, caused total irreversible inhibition of aphid AChE, 95% inhibition of AChE from the malaria vector mosquito (Anopheles gambia), and >80% inhibition of activity from the yellow fever mosquito (Aedes aegypti) and northern house mosquito (Culex pipiens). We now find the same compounds inhibit AChE from cockroaches (Blattella germanica and Periplaneta americana), the flour beetle (Tribolium confusum), the multi-colored Asian ladybird beetle (Harmonia axyridis), the bed bug (Cimex lectularius), and a wasp (Vespula maculifrons), with IC(50) values of approximately 1-11muM. Our results support further study of Cys-targeting inhibitors as conceptually novel insecticides that may be free of resistance in a range of insect pests and disease vectors and, compared with current compounds, should demonstrate much lower toxicity to mammals, birds, and fish.",valid
8581152,"A case of mixed connective tissue disease (MCTD) in a female with positive ribonucleoprotein antibody and overlapped manifestations of systemic lupus erythematosus and dermatomyositis is presented. During the last 9 years of her 13 year clinical course, she repeatedly manifested abdominal distension, pneumoperitoneum and malabsorption syndrome. She died, aged 54 years, of respiratory failure secondary to pulmonary compression from marked abdominal distention. Autopsy revealed esophageal fibrosis with ulceration and the typical appearance of pneumatosis cystoides intestinalis (PCI), in association with atrophy and fibrosis of the inner circular muscle layer of the small bowel. The association of PCI with MCTD is reviewed briefly.",valid
32770070,Synapse and dendritic spine loss induced by amyloid-β oligomers is one of the main hallmarks of the early phases of Alzheimer's disease (AD) and is directly correlated with the cognitive decline typical of this pathology. The p75 neurotrophin receptor (p75,valid
38473922,"Load-bearing biological tissues, such as cartilage and muscles, exhibit several crucial properties, including high elasticity, strength, and recoverability. These characteristics enable these tissues to endure significant mechanical stresses and swiftly recover after deformation, contributing to their exceptional durability and functionality. In contrast, while hydrogels are highly biocompatible and hold promise as synthetic biomaterials, their inherent network structure often limits their ability to simultaneously possess a diverse range of superior mechanical properties. As a result, the applications of hydrogels are significantly constrained. This article delves into the design mechanisms and mechanical properties of various tough hydrogels and investigates their applications in tissue engineering, flexible electronics, and other fields. The objective is to provide insights into the fabrication and application of hydrogels with combined high strength, stretchability, toughness, and fast recovery as well as their future development directions and challenges.",valid
27471660,"There is enormous interest in inferring features of human behavior in the real world from potential digital footprints created online - particularly at the collective level, where the sheer volume of online activity may indicate some changing mood within the population regarding a particular topic. Civil unrest is a prime example, involving the spontaneous appearance of large crowds of otherwise unrelated people on the street on a certain day. While indicators of brewing protests might be gleaned from individual online communications or account content (e.g. Twitter, Facebook) societal concerns regarding privacy can make such probing a politically delicate issue. Here we show that instead, a simple low-level indicator of civil unrest can be obtained from online data at the aggregate level through Google Trends or similar tools. Our study covers countries across Latin America during 2011-2014 in which diverse civil unrest events took place. In each case, we find that the combination of the volume and momentum of searches from Google Trends surrounding pairs of simple keywords, tailored for the specific cultural setting, provide good indicators of periods of civil unrest. This proof-of-concept study motivates the search for more geographically specific indicators based on geo-located searches at the urban level.",valid
27973865,"MXenes, a series of two-dimensional (2D) layered early transition metal carbide, nitride, and carbonitride, have been prepared by exfoliating MAX phases recently. In addition to 2D planar MXene, one-dimensional tubular forms-MXene nanotubes-are also expected to form. Herein, we design atomic models for Ti",valid
31314946,"The increasing engineering of carbon-based nanomaterials as components of neuroregenerative interfaces is motivated by their dimensional compatibility with subcellular compartments of excitable cells, such as axons and synapses. In neuroscience applications, carbon nanotubes (CNTs) have been used to improve electronic device performance by exploiting their physical properties. Besides, when manufactured to interface neuronal networks formation in vitro, CNT carpets have shown their unique ability to potentiate synaptic networks formation and function. Due to the low optical transparency of CNTs films, further developments of these materials in neural prosthesis fabrication or in implementing interfacing devices to be paired with in vivo imaging or in vitro optogenetic approaches are currently limited. In the present work, we exploit a new method to fabricate CNTs by growing them on a fused silica surface, which results in a transparent CNT-based substrate (tCNTs). We show that tCNTs favor dissociated primary neurons network formation and function, an effect comparable to the one observed for their dark counterparts. We further adopt tCNTs to support the growth of intact or lesioned entorhinal-hippocampal complex organotypic cultures (EHCs). Through immunocytochemistry and electrophysiological field potential recordings, we show here that tCNTs platforms are suitable substrates for the growth of EHCs and we unmask their ability to significantly increase the signal synchronization and fiber sprouting between the cortex and the hippocampus with respect to Controls. tCNTs transparency and ability to enhance recovery of lesioned brain cultures, make them optimal candidates to implement implantable devices in regenerative medicine and tissue engineering.",valid
8163698,"To study ulcerative colitis associated neutrophil cytoplasmic antibodies (p-ANCA) in respect of class and subclass distribution, antigen specificity, and (sub)cellular localisation of the antigen(s) to which these antibodies are directed. p-ANCA positivity was determined using the standard indirect immunofluorescence test (IIFT). The immunoglobulin (Ig) subclass distribution of p-ANCA was investigated using monoclonal antibodies directed against IgG1, IgG2, IgG3, and IgG4. Intracellular antigen localisation studies were performed on (fractionated) neutrophils using antigen-specific antibodies. In contrast to vasculitis associated ANCA, ulcerative colitis p-ANCA are mainly of IgG1 and IgG3 subclass and lack IgG4. Ulcerative colitis p-ANCA are myeloid specific. IIFT data indicate that the related antigen(s) seem(s) to be located not in the cytosol, but in the granules (most likely the azurophil granules) of the neutrophil. p-ANCA in ulcerative colitis have a different immunoglobulin subclass distribution than the ANCA of systemic necrotising vasculitis and necrotising and crescentic glomerulonephritis. This may point to differences in immune regulation between these diseases. Both cathepsin G and lactoferrin are recognised by a subpopulation of ulcerative colitis p-ANCA. In our series, eight out of 36 (22%) of ulcerative colitis associated p-ANCA react with lactoferrin and seven (19.5%) other sera with cathepsin G. None of them recognised both antigens. The main target antigen(s) of ulcerative colitis p-ANCA still remain(s) to be identified.",valid
22906180,"Four of the five species of Telopea (Proteaceae) are distributed in a latitudinal replacement pattern on the south-eastern Australian mainland. In similar circumstances, a simple allopatric speciation model that identifies the origins of genetic isolation within temporal geographic separation is considered as the default model. However, secondary contact between differentiated lineages can result in similar distributional patterns to those arising from a process of parapatric speciation (where gene flow between lineages remains uninterrupted during differentiation). Our aim was to use the characteristic distributional patterns in Telopea to test whether it reflected the evolutionary models of allopatric or parapatric speciation. Using a combination of genetic evidence and environmental niche modelling, we focused on three main questions: do currently described geographic borders coincide with genetic and environmental boundaries; are there hybrid zones in areas of secondary contact between closely related species; did species distributions contract during the last glacial maximum resulting in distributional gaps even where overlap and hybridisation currently occur? Total genomic DNA was extracted from 619 individuals sampled from 36 populations representing the four species. Seven nuclear microsatellites (nSSR) and six chloroplast microsatellites (cpSSR) were amplified across all populations. Genetic structure and the signature of admixture in overlap zones was described using the Bayesian clustering methods implemented in STUCTURE and NewHybrids respectively. Relationships between chlorotypes were reconstructed as a median-joining network. Environmental niche models were produced for all species using environmental parameters from both the present day and the last glacial maximum (LGM).The nSSR loci amplified a total of 154 alleles, while data for the cpSSR loci produced a network of six chlorotypes. STRUCTURE revealed an optimum number of five clusters corresponding to the four recognised species with the additional division of T. speciosissima into populations north and south of the Shoalhaven River valley. Unexpectedly, the northern disjunct population of T. oreades grouped with T. mongaensis and was identified as a hybrid swarm by the Bayesian assignment test implemented in NewHybrids. Present day and LGM environmental niche models differed dramatically, suggesting that distributions of all species had repeatedly expanded and contracted in response to Pleistocene climatic oscillations and confirming strongly marked historical distributional gaps among taxes. Genetic structure and bio-climatic modeling results are more consistent with a history of allopatric speciation followed by repeated episodes of secondary contact and localised hybridisation, rather than with parapatric speciation. This study on Telopea shows that the evidence for temporal exclusion of gene flow can be found even outside obvious geographical contexts, and that it is possible to make significant progress towards excluding parapatric speciation as a contributing evolutionary process.",valid
3707149,"THP-adriamycin (THP) is a new derivative of adriamycin (ADM) which is reported to have a lower cardiotoxicity than ADM. In this report, the effects of THP on cell growth, cell cycle traverse and colony-forming ability of RPMI-8402 cells were investigated in comparison with ADM. The growth-inhibitory effect of THP was equal or superior to that of ADM in this system. Analysis of the DNA histogram obtained by flow cytometry showed that THP exerted its growth-inhibitory effect by blocking cells at the G2 phase. At higher concentrations, THP inhibited the traverse of cells through the S phase and further through the whole cell cycle completely. These effects were quite similar to those of ADM, which suggested a similar mechanism of action for the two drugs from the aspect of the cell cycle. A follow-up study of cells accumulated at the G2 phase and a study on colony-forming ability revealed that the G2 phase accumulation was an irreversible and fatal effect of THP, so that G2-phase accumulation could be considered as a cytocidal effect of THP, indicating the clinical usefulness of this system for evaluation of the drug effect. From these results and the low cardiotoxicity, it was suggested that THP could be a good candidate for use as an antitumor agent in clinics.",valid
27536295,"Viruses of human immunodeficiency virus type 2 (HIV-2) and some simian immunodeficiency virus (SIV) lineages carry a unique accessory protein called Vpx. Vpx is essential or critical for viral replication in natural target cells such as macrophages and T lymphocytes. We have previously shown that a poly-proline motif (PPM) located at the C-terminal region of Vpx is required for its efficient expression in two strains of HIV-2 and SIVmac, and that the Vpx expression levels of the two clones are significantly different. Notably, the PPM sequence is conserved and confined to Vpx and Vpr proteins derived from certain lineages of HIV-2/SIVs. In this study, Vpx/Vpr proteins from diverse primate lentiviral lineages were experimentally and phylogenetically analyzed to obtain the general expression picture in cells. While both the level and PPM-dependency of Vpx/Vpr expression in transfected cells varied among viral strains, each viral group, based on Vpx/Vpr amino acid sequences, was found to exhibit a characteristic expression profile. Moreover, phylogenetic tree analyses on Gag and Vpx/Vpr proteins gave essentially the same results. Taken together, our study described here suggests that each primate lentiviral lineage may have developed a unique expression pattern of Vpx/Vpr proteins for adaptation to its hostile cellular and species environments in the process of viral evolution.",valid
2509123,"Treatment of malignant tumors with interferon (IFN) is in some patients accompanied by serious neurological side effects. The present study assessed neurophysiological changes in spontaneous EEG activity, visual-evoked cortical potentials (VEPs), and brainstem auditory-evoked potentials (BAEPs) during IFN-gamma or IFN-alpha therapy in 9 patients. In addition, blood pressure, heart rate and body temperature were monitored. In all sessions under IFN, the latency of the P100 component of the VEP was shortened as compared to baseline conditions. IFN also reduced latencies of BAEP components, and diminished amplitudes of the spontaneous EEG activity within the alpha and beta frequency band. These latter effects were somewhat less consistent than those on VEPs. The major neurophysiological changes appeared to be similar for IFN-gamma and IFN-alpha. The results are in accord with an excitatory effect of IFN on central nervous activity. The magnitude of changes excludes a neurotoxicity of IFN-gamma or IFN-alpha at the doses used in this study.",valid
16307931,"Size of traumatic occult hemothorax on admission requiring drainage has not been defined. Computed axial tomography (CAT) may guide drainage criteria. A retrospective review of patients with hemothoraces on CAT was performed. Extrapolating previously described methods of pleural fluid measurement, hemothoraces were quantified using the fluid stripe in the dependent pleural ""gutter."" Data included patient age, injury severity, and intervention (thoracentesis or tube thoracostomy). Seventy-eight patients with 99 occult hemothoraces met the criteria for study inclusion: 52 hemothoraces qualified as ""minimal"" and 47 as ""moderate/large."" Eight patients (15%) in the minimal group and 31 patients (66%) in the moderate/large group underwent intervention (P < .001). There was no difference in patient age, injury severity, ventilator requirement, or presence of pulmonary contusion. CAT in stable blunt-trauma patients can predict which patients with occult hemothorax are likely to undergo intervention. Patients with hemothorax > or = 1.5 cm on CAT were 4 times more likely to undergo drainage intervention compared with those having hemothorax < 1.5 cm.",valid
18757949,"The advent of computer-assisted knee replacement surgery has focused interest on the alignment of the components. However, there is confusion at times between the alignment of the limb as a whole and that of the components. The interaction between them is discussed in this article. Alignment is expressed relative to some reference axis or plane and measurements will vary depending on what is selected as the reference. The validity of different reference axes is discussed. Varying prosthetic alignment has direct implications for surrounding soft-tissue tension. In this context the interaction between alignment and soft-tissue balance is explored and the current knowledge of the relationship between alignment and outcome is summarised.",valid
16934627,"The purpose of this study was to determine if electronic apex locators (EAL) or electric pulp testers (EPT) interfere with the function of implanted cardiac pacemakers (ICP) or cardioverter/defibrillators (ICD). Twenty-seven patients with ICPs or ICDs had continuous electrocardiogram monitoring and device interrogation to detect interferences during the use of two types of EALs and one EPT. No interferences were detected by any ICP or ICD. In six patients, with intermittent pacing, a significant increase in pacing was observed during EAL/EPT stimulation (p < 0.05). Examination of RR intervals (a measure of intrinsic heart rate) demonstrated significantly longer RR intervals (slower intrinsic heart rate) during EAL/EPT stimulation (p < 0.05). Evaluation of the electrocardiograms for each patient failed to show any abnormalities in pacing during testing. These findings led us to conclude that the increased pacing frequency observed was related to a slower intrinsic heart rate and not electrical interference with the cardiac devices. In conclusion, the two EALs and one EPT used in this study did not interfere with the functioning of any of the cardiac devices tested.",valid
29501407,"Recently recessive mutations in sphingosine-1-phosphate lyase (SGPL1) have been published as a cause of syndromic congenital nephrotic syndrome with adrenal insufficiency. We have identified a case with fetal hydrops and brain malformations due to a mutation in SGPL1. We report a patient presenting with severe fetal hydrops, congenital nephrotic syndrome and adrenal calcifications. MRI imaging showed generalized cortical atrophy with simplified gyral pattern and hypoplastic temporal lobes as well as cerebellar hypoplasia and hyperintensity in the pons. The boy deceased at 6 weeks of age. Via whole exome sequencing, we identified a novel homozygous frameshift mutation c.1233delC (p.Phe411Leufs In our patient, we describe a novel mutation in sphingosine-1-phosphate lyase (SGPL1) leading to severe brain malformation. Neurodevelopmental phenotypes have been reported earlier, but not described in detail. To this end, we present a review on all published SGPL1-mutations and genotype-phenotype correlations focusing on neurodevelopmental outcomes. We hypothesized on the severe neurological phenotypes, which might be due to disruption of neuronal autophagy. Mutations in SGPL1 shall be considered in the differential diagnosis of fetal hydrops as well as congenital brain malformations and neuropathies.",valid
24737521,"Acute coronary syndrome (ACS) is a complex multifactorial and polygenic disorder that is thought to result from the interaction between an individual's genetic makeup and various environmental factors. The aim of this study was to investigate the association of a transforming growth factor-β1 (TGF-β1) polymorphism (-509C>T) with ACS in a Chinese Han population. The TGF-β1 polymorphism was evaluated in 336 patients with ACS and 396 healthy control subjects by polymerase chain reaction-restriction fragment length polymorphism. The genotype distributions of the control and ACS groups were in Hardy-Weinberg equilibrium (X(2) = 3.54 and X(2) = 1.72, respectively, P > 0.05). The frequencies of the CC, CT, and TT genotypes were 22.61, 53.57, and 20.83% in the ACS group, respectively, whereas they were 8.33, 48.74, and 42.17% in controls. There were significant differences between controls and ACS patients in the frequencies of the CC genotype and the C allele. These results suggest that the promoter polymorphism (-509C>T) in TGF-β1 is associated with ACS in this population. The CC genotype and the C allele of TGF-β1 might be a specific risk factor of ACS in the Chinese Han population in Xinjiang.",valid
8817245,"To analyze the relative contribution of endocrine and physical factors to bone mineral density (BMD) in late menopause, we studied biochemical markers of bone turnover as well as sex and calciotropic hormones in 53 women (mean age 61 +/- 5.3 years), 5 to 23 years after natural menopause. BMD was measured at the lumbar spine and proximal femur by dual energy radiography. Stepwise regression analysis showed that age and PTH levels were the two major factors that significantly accounted for spinal BMD, with a final r2 = 0.27. Plasma androstenedione was the only other variable that contributed, albeit not significantly, to spine BMD increasing the r2 by 2%. Conversely, body mass was the main contributor to femoral BMD at all sites. While serum calcium and urinary hydroxyproline were significant determinants of neck BMD, urinary hydroxyproline and age provided significant source of variation for trochanteric BMD, and circulating FSH for BMD in the Ward's area. The final models gave r2 values of 0.35, 0.31, and 0.23, for neck, trochanter and Ward's areas, respectively. Thus, determinants of bone density differentially affect the vertebral and proximal femoral sites. While increasing age and PTH, probably reflecting a subclinical vitamin D deficiency, explain a decreased vertebral bone density, body mass appears to affect mostly the proximal femur. Circulating androgens play a secondary role. A persistently increased bone turnover state is conducive to lower bone density in late postmenopausal women.",valid
